video_url,user_url,username,title,view_num,created_at,shortdesc,collected_at
/watch?v=u8J-KUb9iiE&pp=ygUNZHVyYSBhY2UgNzIwMA%3D%3D,/@gottalovetheknowledge4749,GottaLove TheKnowledge,Vintage Shimano Dura Ace 7200 quick review,2.4K,4 years,"A quick review of my favorite vintage Shimano Dura Ace 7200 shift levers, rear derailleur and seatpost. Great equipment.",2026-01-22 04:58:18.224907
/watch?v=tr89LFxjdMY&pp=ygUNZHVyYSBhY2UgNzIwMA%3D%3D,/@cr-motube6852,Cr-Mo Tube,Shimano Dura-Ace EX Brake Set / Cr-Mo Tube Components#13 1080HD Pics,483,7 years,SHIMANO DURA ACE EX BR-7200 BLACK SERIES BRAKE SET- NOS - NIB year - 1978.,2026-01-22 04:58:18.226570
/watch?v=TMRmfwnwtCc&pp=ygUNZHVyYSBhY2UgNzIwMA%3D%3D,/@ChrisEnockson,Chris Enockson,The largest pedal spindles ever! Shimano Dura Ace AX.,2.2K,4 years,Check out this awesome old school Shimano Dura Ace AX crankset.,2026-01-22 04:58:18.229896
/shorts/UAq4MsRAbvo,/@gcntech,GCN Tech,The Evolution Of Shimano Dura-Ace! #gcntech #shimano #retrobike #bikebuild,17K,1 year,Can We Turn A Vintage Bike Into A Superbike? | Neo-Retro Bike Build Ep. 1 Watch The Full Video LIVE NOW On #YouTube!,2026-01-22 04:58:18.231265
/shorts/fd5e5adB-JI,/@OnRoadVintageBikes,OnRoad Vintage Bikes,Favorit F1Special + Dura Ace 7200 ... video coming soon,959,3 years,shorts.,2026-01-22 04:58:18.232423
/shorts/9lp9LvyXChk,/@Steelvintagebikes,Steel Vintage Bikes,The Shimano Dura Ace 7800 was the first Shimano groupset to feature 10-speed shifting.,15K,2 years,steelvintagebikes #vintagebikes #shimano #shimanoduraace #duraace #duraace7800 #bike #bicycle #cycling #bike.,2026-01-22 04:58:18.235745
/shorts/vxLKdRkttmI,/@Cyclingvideosdaily,Cyclingvideosdaily,The most expensive sound in the world? 💸 #shorts #cycling (skybikes),16K,1 day,Full Black Factor ONE equipped with Shimano Dura-Ace Di2 and Scope wheels. The ultimate aero machine. That freehub sound ...,2026-01-22 04:58:18.238266
/watch?v=BGOmeD9OimU&pp=ygUNZHVyYSBhY2UgNzIwMA%3D%3D,/@gcn,Global Cycling Network,50 Years Of Dura-Ace: From Outsider To Cycling Domination,274K,2 years,"We celebrate 50 years of the Shimano Dura-Ace, tracing the history of the groupset since its launch in 1973. Si rides Sean Yates' ...",2026-01-22 04:58:18.240205
/shorts/QqrzoEIsLLE,/@Mobilant_TV,Mobilant,"Road Bike 🌀 Shimano ""Dura-Ace"" Wireless Ready 🚴‍♂️ GRX Gravel & XTR MTB Groups Announced – 2025",31K,6 months,4 MASTER BOOKS AMAZON ...,2026-01-22 04:58:18.243745
/shorts/ILR-WP3_gBQ,/@ra-cycles,R&A Cycles,Shimano Dura-Ace RD-7402 8s Rear Derailleur,1K,2 years,"1989-1996 @RideShimano Dura-Ace RD-7402 8s Rear Derailleur If this was the look of today's rear #derailleur, I wouldn't mind.",2026-01-22 04:58:18.245955
/shorts/r7CCYgz4kg8,/@bikeradar,BikeRadar,Shimano Recalls 2.8 MILLION Cranks! 🤯 All You Need To Know,34K,2 years,#cycling #tech #recall #shimano #shortsfeed #shortsvideo #shorts #productrecall #broken #damaged #duraace #ultegra Listen to ...,2026-01-22 04:58:18.250829
/shorts/Y82bfNVnPcs,/@theproscloset,The Pro's Closet,Shimano Dura Ace vs SRAM RED AXS Our Uncensored Thoughts | TPC #cycling #shimano #sram #roadbike,3.6K,1 year,And I hated it I would I would constantly misshift it tell me how you really feel Shimano was noticeably quicker and we even lined a ...,2026-01-22 04:58:18.252424
/watch?v=LIujfkyVbqw&pp=ygUNZHVyYSBhY2UgNzIwMA%3D%3D,/@shimanocorporate,株式会社シマノ コーポレート,The History of DURA-ACE　Shimano's Centennial Teaser Site,60K,5 years,The history of DURA-ACE is a history of continuous evolution powered by Shimano's advanced technological development ...,2026-01-22 04:58:18.256647
/watch?v=MyN7rBORDBY&pp=ygUNZHVyYSBhY2UgNzIwMA%3D%3D,/@tuanvlog3805,PAT VLOG chuyên xe đạp thể thao classic,Muller với group dura-ace 7200 ☎️ 0918409990 để biết chi tiết.,485,9 months,... 50 ống ngang 50 ống đứng 49 ống ngang 51 đó và nó trang bị full bộ RS của Shimano durax 7200 Và nó có cái cặp đùm 7200 ...,2026-01-22 04:58:18.259232
/watch?v=jlrgHpX-fGg&pp=ygUNZHVyYSBhY2UgNzIwMA%3D%3D,/@OnRoadVintageBikes,OnRoad Vintage Bikes,Favorit F1 Special + Dura Ace 7200 BUILD,10K,3 years,Podařilo se mně koupit Favorit F1 Speciál v jednašedesátce v původním lehce pošramoceném laku. A protože Favoritů na ...,2026-01-22 04:58:18.260629
/watch?v=5j6WF6-NR98&pp=ygUNZHVyYSBhY2UgNzIwMA%3D%3D,/@sunagane_,Daisuke Sunagane,Shimano DURA-ACE EX RD-7200,1K,6 years,front:52-42T rear:13-21T(7s) shifter:Campagnolo Nuovo Record スラントしてないのが時代を感じますね.,2026-01-22 04:58:18.263965
/watch?v=gDKfNmkJfus&pp=ygUNZHVyYSBhY2UgNzIwMA%3D%3D,/@OnRoadVintageBikes,OnRoad Vintage Bikes,Shimano Dura Ace & Favorit F1 Special BUILD,24K,5 years,Při stavbě tohoto kola Favorit F1 Special jsme použili sadu Shimano Dura Ace 1. generace. Rám s vidlicí byl restaurován.,2026-01-22 04:58:18.267438
/watch?v=tsZLOM_1D7Y&pp=ygUNZHVyYSBhY2UgNzIwMA%3D%3D,/@bikesbymike,Bikes by Mike,Shimano Di2 Dura-Ace R9270: The Best Road Groupset Ever?,4.2K,2 years,"In this video I review Shimano's newest version of their top-tier, Dura-Ace groupset, the 12-speed, semi-wireless R9270. This is ...",2026-01-22 04:58:25.260183
/watch?v=nnhyPntYn4Y&pp=ygUNZHVyYSBhY2UgNzIwMNIHCQmHCgGHKiGM7w%3D%3D,/@newoldsteelcycling,NewOldSteelCycling,Are The Shimano Ultegra/600 Downtube Shifters Better Than The Dura Ace 7700 Shifters? Review!,14K,3 years,"Hello again! This video does have a review mixed with discussion on downtube shifters! Also, component update on my ...",2026-01-22 04:58:25.263498
/watch?v=FZnYQ58cLHk&pp=ygUNZHVyYSBhY2UgNzIwMA%3D%3D,/@Mapdec,Mapdec Cycle Works,Is Shimano About To Change Everything With Dura-Ace?,53K,5 months,"The wireless shifting generation is almost complete, just the Shimano Road groupsets remain somewhat wired. That must be ...",2026-01-22 04:58:25.265733
/watch?v=CHrlw0dq1gA&pp=ygUNZHVyYSBhY2UgNzIwMA%3D%3D,/@jinxshiang1747,Jinx Shiang,Shimano DURA ACE st-7900 shifter X DURA ACE Rd-7900 Rear derailleur X Campagnolo Veloce cassette,479,3 years,Shimano Dura-ace歷史進程: ----7100(5/6S)外走線/SIS --- Dura-Ace 10 (1S)/場地套件 --- 7200 EX(6S)外走線/SIS、UniGlide ...,2026-01-22 04:58:25.267795
/shorts/XNIlXIKtAPA,/@cyclingweekly,Cycling Weekly,How do Sram Red and Shimano Dura-ace compare? #bikes #bicycles #cycling #roadcycling,7.8K,1 year,We may earn a commission when purchasing through affiliate links in this description. Subscribe to Cycling Weekly here: ...,2026-01-22 04:58:25.269241
/shorts/ZDYXLIurLYU,/@davidarthur,David Arthur - Just Ride Bikes,Best groupset ever made? #shorts #bikeshorts #cycling #cyclingshorts #bikes,38K,2 years,Shimano's R9100 Dura-Ace groupset might be the last great mechanical gearing system ever made.,2026-01-22 04:58:25.274843
/watch?v=Gm-CYmLgLnc&pp=ygUNZHVyYSBhY2UgNzIwMA%3D%3D,/@GCPerformance18,GC Performance,What Can We Expect From NEW Shimano Dura-Ace?,23K,5 months,Here is the link for the MMG Shirt: https://gcperformanceyt.com/ CERAMIC OSPW FOR ONLY $350!! AND CERAMIC BOTTOM ...,2026-01-22 04:58:25.279495
/watch?v=oCTOAfNuBuw&pp=ygUNZHVyYSBhY2UgNzIwMA%3D%3D,/@theproscloset,The Pro's Closet,Shimano Dura Ace Di2 vs  SRAM RED AXS: Our Uncensored Thoughts | TPC,21K,1 year,Craig has a 12-speed Shimano Dura-Ace Di2 group. Justin has the new SRAM RED AXS group. We asked them to switch bikes ...,2026-01-22 04:58:25.283089
/watch?v=8amaRgc6aI0&pp=ygUNZHVyYSBhY2UgNzIwMA%3D%3D,/@AXtoTORA,AXとトラ,SHIMANO  DURA-ACE AX  シマノ　エアロロードバイク,2.2K,4 years,カワムラ ニシキ エアログローバル というフレームに、 デュラエースAXのコンポーネントを装着してみました。 #としとらちゃん ...,2026-01-22 04:58:25.285525
/watch?v=co0CtqNUfjY&pp=ygUNZHVyYSBhY2UgNzIwMA%3D%3D,/@dabrestauracion7404,DAB CUSTOM CYCLES,VINTAGE ROAD BIKE BUILD -COLNAGO C 40 MK1-🚀SHIMANO DURA-ACE🚀,36K,4 years,"VINTAGE ROAD BIKE BUILD -COLNAGO C 40 MK1-  SHIMANO DURA-ACE   Hello friends, today I bring you a build of a ...",2026-01-22 04:58:25.288028
/watch?v=dYR_lmo0lzA&pp=ygUNZHVyYSBhY2UgNzIwMA%3D%3D,/@gottalovetheknowledge4749,GottaLove TheKnowledge,vintage Shimano Dura Ace 7400 component review,7.5K,4 years,Vintage Shimano Dura Ace 7400 component review of a few components that I still own. Great equipment if one plans on ...,2026-01-22 04:58:25.289943
/shorts/-mrVOXLpba0,/@JacksCoaching,Jack's Coaching,4 Better Upgrades than Dura-Ace 💸,59K,3 months,"Dura-Ace may look amazing — but is it worth the price? Shimano's flagship groupset is about 450 g lighter than 105, yet costs ...",2026-01-22 04:58:25.294802
/watch?v=EnM_ooYiRok&pp=ygUNZHVyYSBhY2UgNzIwMNIHCQmHCgGHKiGM7w%3D%3D,/@RideShimano,#RideShimano,Next-gen DURA-ACE - Never compromise | SHIMANO,309K,4 years,"The new DURA-ACE is here! Wireless cockpit, more aero and faster than ever! Find out how we took years to give you seconds.",2026-01-22 04:58:25.296333
/watch?v=PRu7OeQRCCE&pp=ygUNZHVyYSBhY2UgNzIwMA%3D%3D,/@gcn,Global Cycling Network,First Ride! NEW Shimano Dura Ace R9100 Groupset,275K,9 years,"The new Shimano Dura Ace R9100 groupset has seen some significant changes. But, what is it like to ride? Subscribe to GCN: ...",2026-01-22 04:58:33.703860
/watch?v=qyusnboYJlU&pp=ygUNZHVyYSBhY2UgNzIwMA%3D%3D,/@cyclingunboxed,Cycling unboxed,SRAM Red or Shimano Dura-Ace | Which would I choose? 👀,11K,9 months,I have finally managed to get a few days of riding on the new Sram Red and I wanted to make a video comparing all the ...,2026-01-22 04:58:33.709246
/watch?v=B7o64rv5Pz0&pp=ygUNZHVyYSBhY2UgNzIwMA%3D%3D,/@jonmaloneycycling7593,Jon Maloney Cycling,Dura Ace 9270 Shifting Gears And What It Feels Like #DuraAce #cycling,11K,4 years,My Strava https://www.strava.com/athletes/2545177 Facebook https://www.facebook.com/JonathanMaloney123 Instagram ...,2026-01-22 04:58:33.711376
/watch?v=X_0BYxKQr5k&pp=ygUNZHVyYSBhY2UgNzIwMA%3D%3D,/@RideShimano,#RideShimano,A first look at next-gen DURA-ACE | SHIMANO,481K,4 years,"The new DURA-ACE is here! Wireless cockpit, more aero and faster than ever! Check out an overview of the new products.",2026-01-22 04:58:33.715438
/shorts/9mYIhJsXfLI,/@gcn,Global Cycling Network,ICONIC Dura-Ace bikes! 😍,20K,2 years,50 candles on Dura-Ace's birthday cake meant that Si had the opportunity to take a look at some of the MOST ICONIC bikes from ...,2026-01-22 04:58:33.717772
/shorts/TgnapKqfteM,/@OnRoadVintageBikes,OnRoad Vintage Bikes,Koga Miyata  + Dura  Ace AX,2K,3 years,shorts.,2026-01-22 04:58:33.719309
/shorts/G5i0TwU0Njo,/@EurekaBikeworks,Eureka Bikeworks,40yeas old DURA-ACE #shorts,131,4 years,Twitter : https://twitter.com/eurekabikeworks instagram : https://www.instagram.com/eurekabikeworks/ #eurekabikeworks ...,2026-01-22 04:58:33.724104
/watch?v=ZprEPXOokMU&pp=ygUNZHVyYSBhY2UgNzIwMA%3D%3D,/@ridesofjapan,Rides of Japan,Dura Ace 9270 12 speed arrived! Actual weights & Installation notes,142K,4 years,"So it has arrived, the new Shimano Dura Ace R9200 (9270) semi-wireless di2 disc brake first release kit. In this first video, ...",2026-01-22 04:58:33.726111
/watch?v=6si2XSCbdGQ&pp=ygUNZHVyYSBhY2UgNzIwMA%3D%3D,/@gcn,Global Cycling Network,How Different Are Shimano 105 & Dura-Ace?,1.4M,7 years,"Shimano brought out a new version of its 105 groupset in 2018, but how does it compare to the top of the range Dura-Ace? We're ...",2026-01-22 04:58:33.730441
/watch?v=Cnz7PmgVhn4&pp=ygUNZHVyYSBhY2UgNzIwMA%3D%3D,/@cr-motube6852,Cr-Mo Tube,Shimano Dura-Ace 7120 Hubs / Cr-Mo Tube Components#14 1080HD Pics,439,7 years,Video available in HD ✓ ☆ Leave Your Like ✓ ☆ Sign up ✓ ☆ Vídeo disponível em HD ✓ ☆ Deixe seu Like ✓ ☆ Inscreva-se ...,2026-01-22 04:58:33.732060
/watch?v=GnBvRaAzal0&pp=ygUNZHVyYSBhY2UgNzIwMA%3D%3D,/@gcn,Global Cycling Network,NEW Dura-Ace R9200 First Look & Ride!,242K,4 years,"Dura-Ace R9200 is Shimano's new generation top-level groupset, and has some big changes from its predecessor, including ...",2026-01-22 04:58:33.734209
/watch?v=RkZ2Noabbbg&pp=ygUNZHVyYSBhY2UgNzIwMA%3D%3D,/@EurekaBikeworks,Eureka Bikeworks,Vintage shimano derailleur restoration. DURA-ACE 40 years old.(RD-7200),3.5K,4 years,Twitter : https://twitter.com/eurekabikeworks instagram : https://www.instagram.com/eurekabikeworks/ #eurekabikeworks ...,2026-01-22 04:58:33.735412
/watch?v=LNb9zlpJqjk&pp=ygUNZHVyYSBhY2UgNzIwMA%3D%3D,/@TheSweetCyclists,The Sweet Cyclists,Shimano Dura-Ace PD-R9100 Carbon Road Cycling Pedal Review - feat. SPD-SL / Look Keo Compatible,3.2K,9 months,Shimano's Dura-Ace pedals are the lightest and most advanced road cycling pedals that Shimano currently offers. The Dura-Ace ...,2026-01-22 04:58:33.738522
/watch?v=s8QANNF3bfQ&pp=ygUNZHVyYSBhY2UgNzIwMA%3D%3D,/@davidarthur,David Arthur - Just Ride Bikes,Still the ultimate groupset? Shimano Dura-Ace Di2 R9170 review,39K,5 years,Is this as good as it gets? Shimano Ultegra https://youtu.be/5UUjACUoiUI Shimano 105 https://youtu.be/FK322k0U-rw Follow me: ...,2026-01-22 04:58:33.741582
/watch?v=OgJf8DgnVAw&pp=ygUNZHVyYSBhY2UgNzIwMA%3D%3D,/@xeapnhapkhau-tanphuhcm991,Xe Đạp Nhập Khẩu - Tân Phú HCM,Xe cổ nguyên bản Raleigh của Anh gruop Dura Ace 7200 rất mới lh 0913.115.116,235,3 months,Xe cổ nguyên bản Raleigh của Anh gruop Dura Ace 7200 rất mới lh 0913.115.116.,2026-01-22 04:58:33.742867
/watch?v=Sw7nLF-YbKU&pp=ygUNZHVyYSBhY2UgNzIwMA%3D%3D,/@actouraine,Avenir Cycliste Touraine AC-TOURAINE,Shimano Dura Ace 7900 Installation Guide SD,90K,11 years,Guide d'installation et de réglage du Dura Ace 7900.,2026-01-22 04:58:33.746975
/watch?v=HDQdoxW2b2w&pp=ygUNZHVyYSBhY2UgNzIwMA%3D%3D,/@BicycleRestorationMan,Bicycle Restoration Man,How to install Shimano Dura Ace AX Shifter Cables,2.2K,5 years,This Video shows you how to install Shimano Dura Ace AX shifter cables on your bicycle. It will show you the various cable guides ...,2026-01-22 04:58:33.748921
/watch?v=6O_prQLjSOA&pp=ygUNZHVyYSBhY2UgNzIwMA%3D%3D,/@ride-media,ridemedia,Bike Build: Shimano's new R9200 Dura-Ace groupset + Factor O2 – workshop session at Wheelhaus,10K,4 years,Shimano launched its new Dura-Ace groupset in September 2021. It's not easy to find in the shops – as an ensemble or on bikes...,2026-01-22 04:58:41.580683
/watch?v=_VyMtJpWK2M&pp=ygUNZHVyYSBhY2UgNzIwMA%3D%3D,/@chainreactioncycles,Chain Reaction Cycles,Shimano Dura-Ace 7900 10 Speed Rear Mech Review,6.3K,13 years,Shimano Dura-Ace 7900 10 Speed Rear Mech Buy now at Chain Reaction Cycles ...,2026-01-22 04:58:41.582569
/watch?v=0jCsUCxMYN0&pp=ygUNZHVyYSBhY2UgNzIwMA%3D%3D,/@BuffsVintageBikes,Buffs Vintage Bikes,Restoring a classic Dura-Ace crankset,10K,4 years,This video will take you through the process use to restore a classic Dura-Ace 7402 crankset. Check out http://smoovelube.com to ...,2026-01-22 04:58:41.588645
/watch?v=Opxz6-oVtvg&pp=ygUNZHVyYSBhY2UgNzIwMA%3D%3D,/@DanyoSports,DanyoSports,Peugeot PB-9 X Dura-Ace 7700,6.9K,5 years,"If you see this, please come and take it back. Restoring brother's Peugeot PB-9 from the 1990's, the frame and fork were blasted ...",2026-01-22 04:58:41.591132
/shorts/dBMnA7oJmrQ,/@AnotherBicycleChannel,AnotherBicycleChannel,Why are dura ace rim brakes still heavy?,2.2K,9 days,Dura ace 9000 rimbrakes swapped for kcnc cb10 Difference in weight 110 G #kcnc #shimano #duraace #bike #biketuning ...,2026-01-22 04:58:41.592467
/shorts/0OvsK9cQksg,/@buycycle,buycycle,Everything you NEED to know about Shimano DI2! Full video out now😍👌🏻 #cycling #shimano #shorts #sub,93K,2 years,"Everything you need to know about the newest and latest Shimano DI2! How to check the battery status and charge, the different ...",2026-01-22 04:58:41.596053
/shorts/8jbH5Z0AD7U,/@gcntech,GCN Tech,🕵️ Secret Features Of Your Shimano Di2 Groupset #ShimanoDi2 #gcntech #gcn #biketech,610K,1 year,"Alex is here to give you some tips, tricks, and secrets! https://gcn.eu/4lvRju Paid Promotion with @RideShimano Useful ...",2026-01-22 04:58:41.597416
/shorts/fAagR8Lv1as,/@NovanAdrian,Novan Adrian,SHIMANO CRANK ARM WEIGHT COMPARISON | 105 vs Duraace,13K,3 years,Social Media Twitter - @novanningnong Facebook - http://facebook.com/n04n078/ Instagram - novanadrian Credits Music Songs ...,2026-01-22 04:58:41.599103
/shorts/58J6PJ5Gm1U,/@overweightbadger,Overweightbadger ,Shimano Dura ace Vs 105 12 speed Rotor weight difference,671,1 year,"real life weights with lock rings for 105 and Dura ace rotors, a sub £100/euro way to save a few grams of your wheelset also they ...",2026-01-22 04:58:41.600532
/watch?v=rSJAKIEHOO4&pp=ygUNZHVyYSBhY2UgNzIwMA%3D%3D,/@FreeToCycle,Free To Cycle,Shimano Dura Ace R9100 Front Derailleur Fitting Guide,34K,7 years,Shimano Dura Ace R9100 Front Derailleur Fitting Guide Mounting Bolt 5-7nm (5mm Hex) Pinch Bolt 6-7nm (4mm Hex) If you ...,2026-01-22 04:58:41.604549
/watch?v=FViWqOPesfM&pp=ygUNZHVyYSBhY2UgNzIwMA%3D%3D,/@OnRoadVintageBikes,OnRoad Vintage Bikes,EDDY MERCKX Corsa Extra and Dura Ace 7400 build,29K,4 years,Eddy Merckx! Everyone knows the name of this famous cyclist. And the Corsa Extra is familiar to anyone who loves steel ...,2026-01-22 04:58:41.605814
/watch?v=kdQEJdYYzJI&pp=ygUNZHVyYSBhY2UgNzIwMA%3D%3D,/@trivinhhien441,Tri Vinh Hiển,Shimano Dura Ace fd-7200,441,4 years,"Bộ đề trước/ sau của hãng Shimano ra đời vào những năm 1982. Cấu trúc nhôm & thép. Củ đề trước nặng gần 100g, củ đề sau ...",2026-01-22 04:58:41.607153
/watch?v=rJOwHbpGTwM&pp=ygUNZHVyYSBhY2UgNzIwMA%3D%3D,/@FreeToCycle,Free To Cycle,Shimano Dura Ace R9100 Rear Derailleur Fitting Guide,39K,6 years,Shimano Dura Ace R9100 rear derailleur fitting guide Front Braze-On Derailleur fitting guide ...,2026-01-22 04:58:41.611195
/watch?v=l8sjEfkAA-Y&pp=ygUNZHVyYSBhY2UgNzIwMA%3D%3D,/@RetroRebuilds,Retro Rebuilds,How To Rebuild a Shimano Dura Ace 7402 Derailleur,2.2K,2 years,Thanks to Silicon Valley Bicycle Exchange for lending me this derailleur! https://bikex.org/ Ignore this: Rebuild Service ...,2026-01-22 04:58:41.612598
/shorts/ViFW7we0ULo,/@IKnowAGuyBicycles,I Know A Guy Bicycles,Trek 2500 (Made in the USA) Shimano Dura-Ace Carbon Classic Road Bike  #usedbikes #sports #bicycle,519,2 years,"Buying a used bicycle can be a great way to save money on a new bike. However, it is important to inspect the bike carefully ...",2026-01-22 04:58:41.613910
/watch?v=9IyALh_82KA&pp=ygUNZHVyYSBhY2UgNzIwMA%3D%3D,/@zulbmc,Head Workz,Dura Ace AX Polished,66,3 years,Vintage Dura Ace.,2026-01-22 04:58:41.617203
/watch?v=3YH4uVEnvSo&pp=ygUNZHVyYSBhY2UgNzIwMA%3D%3D,/@trivinhhien441,Tri Vinh Hiển,Group Shimano Dura Ace 7200,7.6K,3 years,dura-ace #duraace #dura7200 #shimano dura.,2026-01-22 04:58:41.618658
